request_id,category,customer_question,agent_response
"manual_out_008","out_of_scope","اكتب لي قصيدة حب","أنا متخصص في خدمات Rcell فقط. يمكنني مساعدتك في الإنترنت، الباقات، الشريحة، التطبيقات، الرصيد، أو خدمات الدعم."
"manual_out_009","out_of_scope","ما أفضل هاتف أشتريه؟","أنا متخصص في خدمات Rcell فقط. يمكنني مساعدتك في الإنترنت، الباقات، الشريحة، التطبيقات، الرصيد، أو خدمات الدعم."
"manual_out_010","out_of_scope","اشرح لي الذكاء الاصطناعي","أنا متخصص في خدمات Rcell فقط. يمكنني مساعدتك في الإنترنت، الباقات، الشريحة، التطبيقات، الرصيد، أو خدمات الدعم."
"manual_out_011","out_of_scope","ترجم لي مقالة طويلة للإنجليزية","أنا متخصص في خدمات Rcell فقط. يمكنني مساعدتك في الإنترنت، الباقات، الشريحة، التطبيقات، الرصيد، أو خدمات الدعم."
"manual_out_012","out_of_scope","ما هي عاصمة كندا؟","أنا متخصص في خدمات Rcell فقط. يمكنني مساعدتك في الإنترنت، الباقات، الشريحة، التطبيقات، الرصيد، أو خدمات الدعم."
"manual_out_013","out_of_scope","ساعدني في حجز فندق","أنا متخصص في خدمات Rcell فقط. يمكنني مساعدتك في الإنترنت، الباقات، الشريحة، التطبيقات، الرصيد، أو خدمات الدعم."
"manual_out_014","out_of_scope","ما نتيجة مباراة اليوم؟","أنا متخصص في خدمات Rcell فقط. يمكنني مساعدتك في الإنترنت، الباقات، الشريحة، التطبيقات، الرصيد، أو خدمات الدعم."
"manual_out_015","out_of_scope","اكتب لي سيرة ذاتية","أنا متخصص في خدمات Rcell فقط. يمكنني مساعدتك في الإنترنت، الباقات، الشريحة، التطبيقات، الرصيد، أو خدمات الدعم."
"manual_out_016","out_of_scope","أريد نصيحة طبية عن ألم الرأس","أنا متخصص في خدمات Rcell فقط. يمكنني مساعدتك في الإنترنت، الباقات، الشريحة، التطبيقات، الرصيد، أو خدمات الدعم."
"manual_out_017","out_of_scope","ما حكم قانوني لعقد الإيجار؟","أنا متخصص في خدمات Rcell فقط. يمكنني مساعدتك في الإنترنت، الباقات، الشريحة، التطبيقات، الرصيد، أو خدمات الدعم."
"manual_out_018","out_of_scope","اعمل لي خطة تمارين رياضية","أنا متخصص في خدمات Rcell فقط. يمكنني مساعدتك في الإنترنت، الباقات، الشريحة، التطبيقات، الرصيد، أو خدمات الدعم."
"manual_out_019","out_of_scope","من فاز بجائزة نوبل؟","أنا متخصص في خدمات Rcell فقط. يمكنني مساعدتك في الإنترنت، الباقات، الشريحة، التطبيقات، الرصيد، أو خدمات الدعم."
"manual_out_020","out_of_scope","أريد تعلم اللغة الإسبانية","أنا متخصص في خدمات Rcell فقط. يمكنني مساعدتك في الإنترنت، الباقات، الشريحة، التطبيقات، الرصيد، أو خدمات الدعم."
